{
    "input_image_check": "https://files.catbox.moe/yyoaah.jpg",
    "final_width": 1024,
    "tag_prompt": "Describe the image, person and text in detail, using the format of a text-to-image prompt.",
    "additional_prompt": "ultra realistic",
    "tag_seed": 0,
    "tag_temp": 0.6,
    "tag_max_tokens": 2048,
    "seed": 0,
    "steps": 20,
    "guidance": 3.5,
    "lora_file": "xlabs_realism.safetensors",
    "lora_strength_model": 1.0,
    "lora_strength_clip": 1.0,
    "sampler_name": "euler",
    "scheduler": "simple"
}